{
  "id": "urn:ngsi-ld:DigitalAsset:Acme-GA4",
  "type": "DigitalAsset",
  "name": "Acme Web (GA4)",
  "alternateName": "AcmeOne GA4",
  "description": "GA4 property tracking the acme.example corporate website.",
  "digitalAssetUrl": "https://acme.example",
  "digitalAssetKind": "Web",
  "externalId": "properties/123456789",
  "refBrand": "urn:ngsi-ld:Brand:Acme",
  "refSoftwareApplication": "urn:ngsi-ld:SoftwareApplication:GoogleAnalytics4"
}
