{
  "id": "urn:ngsi-ld:DigitalAsset:Acme-LinkedIn",
  "type": "DigitalAsset",
  "name": "Acme LinkedIn Page",
  "alternateName": "Acme LinkedIn",
  "description": "LinkedIn organization page of Acme; metrics ingested via the LinkedIn Marketing API.",
  "digitalAssetUrl": "https://www.linkedin.com/company/acme",
  "digitalAssetKind": "SocialProfile",
  "externalId": "12345678",
  "refBrand": "urn:ngsi-ld:Brand:Acme",
  "refSoftwareApplication": "urn:ngsi-ld:SoftwareApplication:LinkedInMarketingAPI"
}
